{
  "candidate_id": "case_001",
  "judgement": "promoted",
  "confidence": 0.81,
  "reason_summary": "Strong fit, recent supporting evidence, and acceptable evidence depth justify immediate review.",
  "key_factors": [
    "High relevance to target profile",
    "Evidence is recent",
    "Multiple sources support the candidate"
  ],
  "recommended_action": "prioritise_for_review"
}
